{
  "schema_version": 1,
  "generated_at": "2026-06-04T05:30:53Z",
  "scope": "all",
  "nodes": [
    {
      "id": "pages.list.loading",
      "route": "/pages",
      "preconditions": [
        "pages-query:in-flight"
      ],
      "description": "Initial route-level loading state shown by Next.js loading.tsx. Header is rendered with skeleton toolbar and a 6-tile skeleton grid (aspect 9:16) while the page bundle and pages query resolve.",
      "interactions": [],
      "transitions_to": [
        "pages.list.empty",
        "pages.list.grid-view",
        "pages.list.list-view"
      ],
      "source_refs": [
        "web/src/app/pages/loading.tsx",
        "web/src/components/page-layout.tsx"
      ],
      "i18n_sensitive": true
    },
    {
      "id": "pages.list.grid-loading",
      "route": "/pages",
      "preconditions": [
        "pages:fetching"
      ],
      "description": "PageGridSelector's own loading state (after the route resolves but the pages list is still loading). Shows aria-busy=true with 4 skeleton tile placeholders in grid mode.",
      "interactions": [],
      "transitions_to": [
        "pages.list.grid-view",
        "pages.list.empty"
      ],
      "source_refs": [
        "web/src/components/page-grid-selector.tsx"
      ]
    },
    {
      "id": "pages.list.list-loading",
      "route": "/pages",
      "preconditions": [
        "pages:fetching",
        "viewMode:list"
      ],
      "description": "PageGridSelector loading state in list view mode. Renders 4 stacked skeleton rows of height 14 while pages query resolves.",
      "interactions": [],
      "transitions_to": [
        "pages.list.list-view",
        "pages.list.empty"
      ],
      "source_refs": [
        "web/src/components/page-grid-selector.tsx"
      ]
    },
    {
      "id": "pages.list.empty",
      "route": "/pages",
      "preconditions": [
        "pages:none"
      ],
      "description": "Empty state when no pages exist for the active device filter. Shows an SVG illustration, 'No pages created yet.' title, description, and a brand 'Create First Page' button linking to /pages/new (with ?device=... when filtered).",
      "interactions": [
        "click:create-first-page",
        "click:new-page-toolbar",
        "click:import-page-toolbar"
      ],
      "transitions_to": [
        "pages.new.flagship",
        "pages.new.note",
        "pages.import-dialog.open"
      ],
      "source_refs": [
        "web/src/components/page-grid-selector.tsx",
        "web/src/components/ui/empty-state.tsx",
        "web/src/app/pages/page.tsx"
      ],
      "i18n_sensitive": true
    },
    {
      "id": "pages.list.grid-view",
      "route": "/pages",
      "preconditions": [
        "pages:>=1",
        "viewMode:grid"
      ],
      "description": "Default grid view: 1-2 column responsive grid of page tiles. Each tile renders a StaticBoardDisplay preview lazily via IntersectionObserver, with the page name and layout icon. Active page shows a bottom underline. View-mode buttons in toolbar show aria-pressed=true on Grid.",
      "interactions": [
        "click:page-tile",
        "click:view-mode-list",
        "click:new-page",
        "click:import-page",
        "click:device-tab"
      ],
      "transitions_to": [
        "pages.edit.loading",
        "pages.list.list-view",
        "pages.new.flagship",
        "pages.import-dialog.open",
        "pages.list.device-tab-note"
      ],
      "source_refs": [
        "web/src/app/pages/page.tsx",
        "web/src/components/page-grid-selector.tsx",
        "web/src/components/page-toolbar.tsx"
      ],
      "i18n_sensitive": true
    },
    {
      "id": "pages.list.list-view",
      "route": "/pages",
      "preconditions": [
        "pages:>=1",
        "viewMode:list"
      ],
      "description": "Compact list view (no preview): single-column rows showing icon, page name, and last-updated date (Clock icon). View-mode toggle persists choice to localStorage key fiestaboard_pages_view_mode.",
      "interactions": [
        "click:page-row",
        "click:view-mode-grid",
        "click:new-page",
        "click:import-page"
      ],
      "transitions_to": [
        "pages.edit.loading",
        "pages.list.grid-view",
        "pages.new.flagship",
        "pages.import-dialog.open"
      ],
      "source_refs": [
        "web/src/components/page-grid-selector.tsx",
        "web/src/app/pages/page.tsx"
      ]
    },
    {
      "id": "pages.list.device-tab-flagship",
      "route": "/pages",
      "preconditions": [
        "board-settings:devices=[flagship,note]"
      ],
      "description": "Flagship device tab active. Shown only when multiple devices are configured. PageGridSelector filters pages where device_type==='flagship'. activeTab state drives which /pages/new?device=... is opened.",
      "interactions": [
        "click:tab-note",
        "click:new-page",
        "click:page-tile"
      ],
      "transitions_to": [
        "pages.list.device-tab-note",
        "pages.new.flagship"
      ],
      "source_refs": [
        "web/src/app/pages/page.tsx",
        "web/src/components/ui/tabs.tsx"
      ]
    },
    {
      "id": "pages.list.device-tab-note",
      "route": "/pages",
      "preconditions": [
        "board-settings:devices=[flagship,note]"
      ],
      "description": "Note device tab active. PageGridSelector filters pages where device_type==='note'. The 'New Page' button now navigates to /pages/new?device=note.",
      "interactions": [
        "click:tab-flagship",
        "click:new-page",
        "click:page-tile"
      ],
      "transitions_to": [
        "pages.list.device-tab-flagship",
        "pages.new.note"
      ],
      "source_refs": [
        "web/src/app/pages/page.tsx"
      ]
    },
    {
      "id": "pages.list.carousels-tab",
      "route": "/pages",
      "preconditions": [
        "carousels:>=1"
      ],
      "description": "When carousels exist and showCarousels=true, the grid is wrapped in a Tabs widget with Pages | Carousels triggers (showing counts). Carousels tab renders a 2-column grid of CarouselButton cards, each a cascading 5-card stack of board previews.",
      "interactions": [
        "click:tab-pages",
        "click:carousel-card"
      ],
      "transitions_to": [
        "pages.list.grid-view"
      ],
      "source_refs": [
        "web/src/components/page-grid-selector.tsx"
      ]
    },
    {
      "id": "pages.import-dialog.open",
      "route": "/pages",
      "preconditions": [],
      "description": "Import Page dialog open (Radix Dialog, sm:max-w-md). Renders a 28-row textarea pre-focused for the share string, plus Cancel and Import buttons. Import is disabled while textarea is empty or import mutation is pending.",
      "interactions": [
        "type:share-string",
        "click:cancel",
        "click:import",
        "keyboard:esc"
      ],
      "transitions_to": [
        "pages.import-dialog.importing",
        "pages.list.grid-view"
      ],
      "source_refs": [
        "web/src/app/pages/page.tsx"
      ],
      "i18n_sensitive": true
    },
    {
      "id": "pages.import-dialog.importing",
      "route": "/pages",
      "preconditions": [
        "import-mutation:pending"
      ],
      "description": "Import button shows 'Importing...' label and is disabled while api.importPage is in flight. Cancel still works.",
      "interactions": [],
      "transitions_to": [
        "pages.import-dialog.success",
        "pages.import-dialog.error"
      ],
      "source_refs": [
        "web/src/app/pages/page.tsx"
      ]
    },
    {
      "id": "pages.import-dialog.error",
      "route": "/pages",
      "preconditions": [
        "import-mutation:error"
      ],
      "description": "Import failed (invalid share string or API error). A sonner error toast surfaces the thrown Error message; dialog remains open with the share-string still populated so the user can retry.",
      "interactions": [
        "edit:share-string",
        "click:cancel",
        "click:import"
      ],
      "transitions_to": [
        "pages.import-dialog.importing",
        "pages.list.grid-view"
      ],
      "source_refs": [
        "web/src/app/pages/page.tsx"
      ]
    },
    {
      "id": "pages.import-dialog.success",
      "route": "/pages",
      "preconditions": [
        "import-mutation:success"
      ],
      "description": "Successful import: pages query invalidated, success toast '<name> added to your pages' appears, dialog closes, and a slide-up view transition pushes the user to /pages/edit/<new-id>.",
      "interactions": [],
      "transitions_to": [
        "pages.edit.clean"
      ],
      "source_refs": [
        "web/src/app/pages/page.tsx"
      ]
    },
    {
      "id": "pages.new.flagship",
      "route": "/pages/new",
      "preconditions": [
        "query:device=flagship|absent"
      ],
      "description": "New page editor mounted via PageEditorShell with deviceType='flagship'. Header reads 'Create Page'; back arrow returns to /pages with slide-down transition. Save button is disabled until name is non-empty.",
      "interactions": [
        "type:name",
        "type:template-line",
        "click:save",
        "click:back",
        "toggle:rich-plain-editor",
        "toggle:live-output"
      ],
      "transitions_to": [
        "pages.new.draft-restored",
        "pages.edit.saving",
        "pages.list.grid-view",
        "pages.new.editor-plain"
      ],
      "source_refs": [
        "web/src/app/pages/new/page.tsx",
        "web/src/components/page-editor-shell.tsx",
        "web/src/components/page-builder.tsx"
      ],
      "i18n_sensitive": true
    },
    {
      "id": "pages.new.note",
      "route": "/pages/new",
      "preconditions": [
        "query:device=note"
      ],